post_id,post_title,comment_id,comment_body,score,created_utc,post_upvotes,post_comments
1k9i6lb,[personal] I completely ruined my skin and hate myself self now,mpeql79,This can be fixed. I had really big pores years ago but I made exfoliating with Neutrogena Clean and Clear part of my routine and now its hard to see mine.,2,1745802199.0,307,122
1k9i6lb,[personal] I completely ruined my skin and hate myself self now,mper18u,Do not go outside without spf. Use very gentle cleanser,2,1745802364.0,307,122
1k9i6lb,[personal] I completely ruined my skin and hate myself self now,mpesc18,Best decision I ever made was switching to only washing my face 1x per day (at night).,2,1745802846.0,307,122
1k9i6lb,[personal] I completely ruined my skin and hate myself self now,mpjk6qn,Don’t worry the damages can be reversed just make sure you are getting the right advice from a skin professional. What helped me was getting HydraFacials it worked wonders for me. Make sure you are hydrated that’s the key,2,1745871764.0,307,122
1k9i6lb,[personal] I completely ruined my skin and hate myself self now,mpknab8,"Babe, your skin’s amazing. You just have pores. Everyone has pores.",2,1745884639.0,307,122
1ka9mph,[acne] why do i always break out after kissing men,mpkgt6s,"



Are you brand new to skincare? Don't know how to build a skincare routine? The best place to start is our [ScA Routine](https://www.reddit.com/r/SkincareAddiction/wiki/sca_routine/)! 

You can find even more skincare guides [in our wiki!](https://www.reddit.com/r/SkincareAddiction/wiki/index). Your answer might already be in there (and if it is, we might remove your post).

Everyone is welcome in [this community](https://www.reddit.com/r/SkincareAddiction/wiki/about); remember to be kind and assume good faith :)


*I am a bot, and this action was performed automatically. Please [contact the moderators of this subreddit](/message/compose/?to=/r/SkincareAddiction) if you have any questions or concerns.*",1,1745882427.0,292,121
1ka9mph,[acne] why do i always break out after kissing men,mpknb2r,"Do they have a beard/stubble? If so, that might be the cause of irritation. If not, it might be their skincare products that you’re sensitive to",660,1745884646.0,292,121
1ka9mph,[acne] why do i always break out after kissing men,mpkj6qw,Cooties,1192,1745883235.0,292,121
1ka9mph,[acne] why do i always break out after kissing men,mpl6g9q,"I’m gonna give a serious answer and say it might be irritation from facial hair if you have sensitive skin.
In my experience with kissing guys, including very hygienic ones I’d get irritation from kissing them if they had facial hair. That irritation didnt usually turn to acne, but it did a few times.

For context: I’m a lesbian but have been involved with theater for over two decades. I have had a lot of variety and have kissed way more men onstage than in daily life.",294,1745891384.0,292,121
1ka9mph,[acne] why do i always break out after kissing men,mpksc4q,"As a dude, I have seen so many men walk out of a bathroom without washing their hands. I don’t even wanna think about what they do for their faces or bodies.",438,1745886406.0,292,121
1ka9mph,[acne] why do i always break out after kissing men,mpkmyle,"Try kissing a girl and come back to us, for science

Jk but girl lose these men lol, find one without a beard and/or with a good wash routine??",466,1745884525.0,292,121
1ka9mph,[acne] why do i always break out after kissing men,mpkhs53,Because boys are yucky.,413,1745882756.0,292,121
1ka9mph,[acne] why do i always break out after kissing men,mpkkyhw,have you seen men “wash” their hands? now just extrapolate that to their faces,278,1745883840.0,292,121
1ka9mph,[acne] why do i always break out after kissing men,mpkk5cm,It’s probably a combination of the stuff they use on their faces (men’s products are not it for sensitive skin even second hand) and or themselves not cleaning their faces well enough. ,89,1745883564.0,292,121
1ka9mph,[acne] why do i always break out after kissing men,mpkvm5w,[ Removed by Reddit ],20,1745887555.0,292,121
1ka9mph,[acne] why do i always break out after kissing men,mpkze4p,My partner has excellent hygiene but I realized if he kisses me after applying beard oil I will sometimes get a breakout around my chin area,28,1745888885.0,292,121
1ka9mph,[acne] why do i always break out after kissing men,mpmoz8z,Could be because of the beard oil or if they have stubble,11,1745917941.0,292,121
1ka9mph,[acne] why do i always break out after kissing men,mpkw3nw,Maybe you’re allergic! Congratulations 🤍,42,1745887724.0,292,121
1ka9mph,[acne] why do i always break out after kissing men,mpkr689,Good thing it’s almost Pride season!,42,1745885998.0,292,121
1ka9mph,[acne] why do i always break out after kissing men,mpkklyb,easy solution: just don’t date men,42,1745883720.0,292,121
1ka9mph,[acne] why do i always break out after kissing men,mpkzttr,"This is why I refuse to kiss/date men with facial hair. The odd times I have, I've gotten terrible rashes. It's not worth it!",14,1745889040.0,292,121
1ka9mph,[acne] why do i always break out after kissing men,mpkm88o,Ew! These guys must be nasty.,15,1745884273.0,292,121
1ka9mph,[acne] why do i always break out after kissing men,mpkq6dt,"Because men don’t wash their faces, or if they do, it’s not enough, and if they have a beard, food and sauce/oil gets caught in it and they only wipe it, they don’t shampoo their beards after every meal",21,1745885648.0,292,121
1ka9mph,[acne] why do i always break out after kissing men,mpkp4jr,Bad hygiene is a  🚩Ewwwww 🤮,17,1745885282.0,292,121
1ka9mph,[acne] why do i always break out after kissing men,mpm14cg,Kiss women instead,9,1745903661.0,292,121
1k6vy3e,[Sun care] Korean sunscreens with Korean UV filters being sold at Marshall’s,mot5upe,"



Are you brand new to skincare? Don't know how to build a skincare routine? The best place to start is our [ScA Routine](https://www.reddit.com/r/SkincareAddiction/wiki/sca_routine/)! 

You can find even more skincare guides [in our wiki!](https://www.reddit.com/r/SkincareAddiction/wiki/index). Your answer might already be in there (and if it is, we might remove your post).

Everyone is welcome in [this community](https://www.reddit.com/r/SkincareAddiction/wiki/about); remember to be kind and assume good faith :)


*I am a bot, and this action was performed automatically. Please [contact the moderators of this subreddit](/message/compose/?to=/r/SkincareAddiction) if you have any questions or concerns.*",1,1745510598.0,261,51
1k6vy3e,[Sun care] Korean sunscreens with Korean UV filters being sold at Marshall’s,mot6xo3,woah for only $10!?!??!?!?! going to my local marshalls,164,1745510910.0,261,51
1k6vy3e,[Sun care] Korean sunscreens with Korean UV filters being sold at Marshall’s,motinz1,"I buy Asian sunscreens in the USA all the time at the Asian grocery, it’s not banned although I don’t think companies in America can use the filters since they’re unapproved. I think the difference is that they’re imported and then sold here, although I don’t know much of the laws. I’d make sure you find out the expiration date though, typically things end up at Ross and Marshall’s because they’re old and therefore the original stores/sellers don’t want them. All of the perfumes I’ve ever bought there were super old and weak.",87,1745514224.0,261,51
1k6vy3e,[Sun care] Korean sunscreens with Korean UV filters being sold at Marshall’s,motb5o0,i love marshall’s they always got the good shit,49,1745512111.0,261,51
1k6vy3e,[Sun care] Korean sunscreens with Korean UV filters being sold at Marshall’s,mot89h6,"Does anyone know this brand specifically? I want it, because I've heard korean skin products are really good, but I don't just want to buy any korean brand yk? 😭",27,1745511289.0,261,51
1k6vy3e,[Sun care] Korean sunscreens with Korean UV filters being sold at Marshall’s,motqsuk,Probably overstock from somewhere that slipped into the inventory without higher ups realizing that it shouldn’t be sold.  I agree with another poster that this one in particular doesn’t seem great bc of the ingredients that can cause irritations.  Probably why it’s overstock!,13,1745516489.0,261,51
1k6vy3e,[Sun care] Korean sunscreens with Korean UV filters being sold at Marshall’s,mou0r0j,"I’m dropping to my knees in the middle of MY Marshall’s 😭 this is all I ever ask for in this sub and Marshall’s one. I’ve seen what you’ve done for others god, me next plz 🤞",5,1745519287.0,261,51
1k6vy3e,[Sun care] Korean sunscreens with Korean UV filters being sold at Marshall’s,moy9sil,"Hate to burst everyone’s bubble, but “drug facts” in pic two means it’s a version with US FDA approved filters.",8,1745580243.0,261,51
1k6vy3e,[Sun care] Korean sunscreens with Korean UV filters being sold at Marshall’s,motwq57,"Marshall's has the hook up!!! I've gotten so many face mask packs from there (cosrx or skin1004), and I always check to see if they have my moisturizer before I sink 20 something bucks at the ulta nearby, haha",12,1745518129.0,261,51
1k6vy3e,[Sun care] Korean sunscreens with Korean UV filters being sold at Marshall’s,mpthgo8,"Woah, for real? That's crazy",4,1746010435.0,261,51
1k6vy3e,[Sun care] Korean sunscreens with Korean UV filters being sold at Marshall’s,mow9dv3,No way!!!! Wow!!!!,2,1745544856.0,261,51
1k6vy3e,[Sun care] Korean sunscreens with Korean UV filters being sold at Marshall’s,moy21tl,For real? That's a good one.,2,1745576370.0,261,51
1k6vy3e,[Sun care] Korean sunscreens with Korean UV filters being sold at Marshall’s,mp9itaj,I've never heard of the brand name but for some reason why it looks very promising,2,1745728594.0,261,51
1k6vy3e,[Sun care] Korean sunscreens with Korean UV filters being sold at Marshall’s,moteomm,How?!,4,1745513112.0,261,51
1k6vy3e,[Sun care] Korean sunscreens with Korean UV filters being sold at Marshall’s,mou9e3k,Holy shit! With PA++++?! I can never find that in real life. I need to get my ass to Marshall's!,4,1745521802.0,261,51
1k6vy3e,[Sun care] Korean sunscreens with Korean UV filters being sold at Marshall’s,mp1ampp,.,1,1745614209.0,261,51
1k6vy3e,[Sun care] Korean sunscreens with Korean UV filters being sold at Marshall’s,mpcqbqf,I bought that same one at TJMaxx on clearance a few months ago and love it.  I use it everyday.  I didn't know they were still selling it either. Thanks for the post and info.,1,1745778410.0,261,51
1k6vy3e,[Sun care] Korean sunscreens with Korean UV filters being sold at Marshall’s,mpjvbjy,Yes! Was also surprised to see my local Marshalls selling Roundlab's Birch Moisturizing Cream. So I got multiple!,1,1745875146.0,261,51
1k6vy3e,[Sun care] Korean sunscreens with Korean UV filters being sold at Marshall’s,moxx319,Thanka for the update!! I was worried about having to buy my AGE20's UV Defense sunscreen in bulk before it went up in price. Hope they add it soon to Marshalls too 😅,1,1745573463.0,261,51
1k6vy3e,[Sun care] Korean sunscreens with Korean UV filters being sold at Marshall’s,motedxz,"There are no ""Korean"" UV filters. I think you mean new generation filters (which by the way, were invented in Germany).",-13,1745513029.0,261,51
1k6rtte,[Misc] You need sunscreen on your face but you don't have access to water and soap. What do you do?,mos79zn,"



Are you brand new to skincare? Don't know how to build a skincare routine? The best place to start is our [ScA Routine](https://www.reddit.com/r/SkincareAddiction/wiki/sca_routine/)! 

You can find even more skincare guides [in our wiki!](https://www.reddit.com/r/SkincareAddiction/wiki/index). Your answer might already be in there (and if it is, we might remove your post).

Everyone is welcome in [this community](https://www.reddit.com/r/SkincareAddiction/wiki/about); remember to be kind and assume good faith :)


*I am a bot, and this action was performed automatically. Please [contact the moderators of this subreddit](/message/compose/?to=/r/SkincareAddiction) if you have any questions or concerns.*",1,1745500246.0,218,187
1k6rtte,[Misc] You need sunscreen on your face but you don't have access to water and soap. What do you do?,mos7nwi,I use sunscreen sticks! :),421,1745500378.0,218,187
1k6rtte,[Misc] You need sunscreen on your face but you don't have access to water and soap. What do you do?,mos9kau,I carry around hand sanitizer and use that as long as my hands are not visibly soiled.,214,1745501020.0,218,187
1k6rtte,[Misc] You need sunscreen on your face but you don't have access to water and soap. What do you do?,mos9qfe,"Wow I feel like a dirt gremlin reading this and the comments, I would apply anyway, with my hands, without a second thought...",1098,1745501075.0,218,187
1k6rtte,[Misc] You need sunscreen on your face but you don't have access to water and soap. What do you do?,mos865g,"Not the answer you were looking for, but I live in Texas so from May to October I’m slathering regardless of the state of my hands because sun exposure here is worse than what I may have touched along the way.",156,1745500551.0,218,187
1k6rtte,[Misc] You need sunscreen on your face but you don't have access to water and soap. What do you do?,mos89ix,Wet wipes.,119,1745500582.0,218,187
1k6rtte,[Misc] You need sunscreen on your face but you don't have access to water and soap. What do you do?,mos9w12,I wear a hat and covering clothes,36,1745501127.0,218,187
1k6rtte,[Misc] You need sunscreen on your face but you don't have access to water and soap. What do you do?,mosajwz,"Baby wipes or any type of wet wipes. 

If you care about the germ element also use alcohol gel.",22,1745501351.0,218,187
1k6rtte,[Misc] You need sunscreen on your face but you don't have access to water and soap. What do you do?,mosbigb,"In all my years riding horses, teaching riding lessons, competing, coaching others at competitions, hot summer days in long riding pants and tall boots, cleaning stalls, feeding, refilling hay, washing out dirty water buckets, standing in dusty arenas, dust so thick it clogs up my nose, cleaning riding equipment, etc… I just put that stuff on with my bare hands, and then I’d eat a sandwich those same hands lol. I wouldn’t even stop to think about it.",95,1745501670.0,218,187
1k6rtte,[Misc] You need sunscreen on your face but you don't have access to water and soap. What do you do?,moss1zt,"If I’m carrying sunscreen, chances are I’m also carrying antibacterial hand wipes and hand sanitizer. I try to always clean my hands before touching my face.",15,1745506665.0,218,187
1k6rtte,[Misc] You need sunscreen on your face but you don't have access to water and soap. What do you do?,mos9y48,"Don’t care, had a melanoma once already",104,1745501146.0,218,187
1k6rtte,[Misc] You need sunscreen on your face but you don't have access to water and soap. What do you do?,mosprum,I’m quite particular about touching my face with dirty hands so I’d probably wait until I could wash them,8,1745506005.0,218,187
1k6rtte,[Misc] You need sunscreen on your face but you don't have access to water and soap. What do you do?,mospzzk,Cleansing wipes ( even those for face or babies) + fragrance free hand sanitizer.,6,1745506072.0,218,187
1k6rtte,[Misc] You need sunscreen on your face but you don't have access to water and soap. What do you do?,mosof3v,"I just apply it without worrying about it. Even if there *is* a bathroom nearby, it would only occur to me to wash my hands if I was slathered in mud or had just picked up dog poop or something. I'm outside in the wind and all kinds of shit is getting blown onto my face anyway! And I'm careful not to put sunscreen in my eyes and mouth anyway (it stings/tastes bad!), so the bacteria is just sitting on the surface, and I'll wash my face at night to get that off.

I believe it is actually not good for you skin to be sanitizing all day, so I try to only do that when eating or after specific exposure to contaminants. (Edit to add: And in reading these comments, I think I have a much higher threshold for what a ""contaminant"" is than some others on here!)",17,1745505605.0,218,187
1k6rtte,[Misc] You need sunscreen on your face but you don't have access to water and soap. What do you do?,mosggmc,Keep a mini bag of make up wipes or baby wipes in your purse,4,1745503236.0,218,187
1k6rtte,[Misc] You need sunscreen on your face but you don't have access to water and soap. What do you do?,mosbjsg,use the other side of your hand,9,1745501682.0,218,187
1k6rtte,[Misc] You need sunscreen on your face but you don't have access to water and soap. What do you do?,mos7y4l,I use sunscreen spray. ;),16,1745500475.0,218,187
1k6rtte,[Misc] You need sunscreen on your face but you don't have access to water and soap. What do you do?,moseftp,"I mean if it's on my hands it's already on my skin... Me diluting it with sunscreen and slathering all over my face won't make the bacteria/gunk/whatnot any more dangerous. I don't put sunscreen inside my face orifices.

If it was visible/tactile dirt, that's a whole other story. I don't like physical exfoliation lol.",9,1745502608.0,218,187
1k6rtte,[Misc] You need sunscreen on your face but you don't have access to water and soap. What do you do?,mosiu9r,"Where am I? If it’s England in December and it’s been a couple of hours, I won’t bother.

If it’s summer or somewhere less cloudy, then I’d hopefully have a sunscreen stick on me, but if I have to use a cream, I’ll deal with dirty hands I guess.",3,1745503956.0,218,187
1k6rtte,[Misc] You need sunscreen on your face but you don't have access to water and soap. What do you do?,mosmt6u,"Before I got my sunscreen stick, i normally keep hand sanitizer with me.l for this exact reason and eating",3,1745505131.0,218,187
1kaige2,[PSA]Changing my water got rid of 90% of my skin problems,mpmha2q,"



Are you brand new to skincare? Don't know how to build a skincare routine? The best place to start is our [ScA Routine](https://www.reddit.com/r/SkincareAddiction/wiki/sca_routine/)! 

You can find even more skincare guides [in our wiki!](https://www.reddit.com/r/SkincareAddiction/wiki/index). Your answer might already be in there (and if it is, we might remove your post).

Everyone is welcome in [this community](https://www.reddit.com/r/SkincareAddiction/wiki/about); remember to be kind and assume good faith :)


*I am a bot, and this action was performed automatically. Please [contact the moderators of this subreddit](/message/compose/?to=/r/SkincareAddiction) if you have any questions or concerns.*",1,1745912934.0,196,33
1kaige2,[PSA]Changing my water got rid of 90% of my skin problems,mpmus33,Interesting actually! Which country do you live in?,74,1745921535.0,196,33
1kaige2,[PSA]Changing my water got rid of 90% of my skin problems,mpndsnr,"I wish so much we could do this. We live in a historic home that cannot accompany a water softener. And our water is chock full of calcium and other minerals, which a water filter can’t deal with. 

What ended up working for me was a non-sulfate cleanser and ph balancing, hydrating toners. I had the same problem you were having, but that solved it. But I want a water system still. I DREAM of having better water. It would make things so much easier.",42,1745930168.0,196,33
1kaige2,[PSA]Changing my water got rid of 90% of my skin problems,mpmlk5i,Interesting! Glad you found such a simple solution that made a big difference. Thanks for sharing,14,1745915704.0,196,33
1kaige2,[PSA]Changing my water got rid of 90% of my skin problems,mpmn165,"That's awesome! We have a filter on all of our shower heads and boy, what a difference.",12,1745916668.0,196,33
1kaige2,[PSA]Changing my water got rid of 90% of my skin problems,mpqpziw,"I had acne problems for a year and then like four days in Tokyo solved 99% of the problem. I get almost mad thinking about it because I'm fairly certain it's the hard water (water quality is otherwise fairly good here) and I can't afford to fix that problem. Except maybe like, buy distilled water to wash my face? Feels luxurious in this economy...Acne wasn't a big problem for me before a cold last year broke me out and I couldn't get it under control though, so I'm hoping after the reset from the trip, I can manage things better for a while.

Anyway, yeah, water makes a huge difference. Maybe it's worth at least using distilled water for the final rinse off...",10,1745966128.0,196,33
1kaige2,[PSA]Changing my water got rid of 90% of my skin problems,mpol9s0,"I have to use distilled water for my face. Rural US on county water and it kills my face, plus has a growing tally of appliances it's merced.",3,1745943696.0,196,33
1kaige2,[PSA]Changing my water got rid of 90% of my skin problems,mpqpwnq,"I had a similar experience! My skin was irritated and breaking out. It really clicked for me that my water was the problem when a hairstylist asked me if I swam because my hair was so chlorine damaged. I have used a number of (showerhead attachment) filters over the years, my favorite being from Aquasana.",3,1745966102.0,196,33
1kaige2,[PSA]Changing my water got rid of 90% of my skin problems,mpr1ofi,"My eczema dramatically increases the harder the water is. Of course, as a child I grew up in a home with VERY hard water. 😭 I now live in a place with ""hard"" water but it's nowhere near as bad as my parents' house. 


When I vacation to places with soft water, I can hot tub multiple times a day without an eczema flare-up. 


I try not to get too upset about the fact that a water softening system could have saved my skin when I was a kid. 😮‍💨",3,1745969999.0,196,33
1kaige2,[PSA]Changing my water got rid of 90% of my skin problems,mpndmi0,I‘d like to know which one you bought?,3,1745930105.0,196,33
1kaige2,[PSA]Changing my water got rid of 90% of my skin problems,mpracw6,damn I never thought about it before thanks for sharing,2,1745972924.0,196,33
1kaige2,[PSA]Changing my water got rid of 90% of my skin problems,mpsons2,"I did this just for my hair and the results are amazing. 

The wire cutter has a page dedicated to at home filters. Several decent companies to choose from.",2,1745993001.0,196,33
1kaige2,[PSA]Changing my water got rid of 90% of my skin problems,mprzi7j,"Yep. I have water filters on my bathroom sink and showerhead, and when I travel, I bring a portable water filter and only use that for my face. Huge difference.",1,1745981626.0,196,33
1kaige2,[PSA]Changing my water got rid of 90% of my skin problems,mpsisl4,"Had a similar experience. I visited a relative's place in a different location from mine and started breaking out immediately. Same skincare, same weather condition, same routine. The only thing different is they have a different water source. Once I got back home and started washing my face with our usual water, my skin cleared up.",1,1745989894.0,196,33
1kaige2,[PSA]Changing my water got rid of 90% of my skin problems,mptzppj,"We have really rest hard water from. Bore. Heavy in minerals and very alkaline. It’s drying for my skin and hair. 
Shampoo and things that are meant to duds up and clean like dishwashing liquid and washing powder can’t work properly. 
When I’m away from home my hair forms natural ringlets and my eczema settles , skin is softer too. 
I warm rain water in the microwave for cleaning my face .",1,1746017912.0,196,33
1k9d1q5,[Hair Removal] Chemical Burn from Nair!,mpd8soz,"



Are you brand new to skincare? Don't know how to build a skincare routine? The best place to start is our [ScA Routine](https://www.reddit.com/r/SkincareAddiction/wiki/sca_routine/)! 

You can find even more skincare guides [in our wiki!](https://www.reddit.com/r/SkincareAddiction/wiki/index). Your answer might already be in there (and if it is, we might remove your post).

Everyone is welcome in [this community](https://www.reddit.com/r/SkincareAddiction/wiki/about); remember to be kind and assume good faith :)


*I am a bot, and this action was performed automatically. Please [contact the moderators of this subreddit](/message/compose/?to=/r/SkincareAddiction) if you have any questions or concerns.*",1,1745784175.0,167,78
1k9d1q5,[Hair Removal] Chemical Burn from Nair!,mpdkkre,and avoid the sun during the healing process,490,1745787783.0,167,78
1k9d1q5,[Hair Removal] Chemical Burn from Nair!,mpder7u,"Burn gel literally, the stuff you put on when you burn yourself in the kitchen.

Also make sure you keep it clean. 

Hope it gets better soon.",257,1745786003.0,167,78
