post_id,post_title,comment_id,comment_body,score,created_utc,post_upvotes,post_comments
1k9d1q5,[Hair Removal] Chemical Burn from Nair!,mpen2vc,"NAD, work inpatient in a hospital where we get lots of cases of cellulitis + similar skin infections. if you can see a doctor, see one - even if it's something like urgent care. if you can see a dermatologist, even better. that looks like a 2nd degree burn in some spots and your epidermis is quite literally peeling away. it's also in a rather delicate location, and i particularly worry about infections starting in warm, moist places like the folds of the neck when you bring your chin down. the face is a bad place for any skin infections to start, and burns get infected so easily.

i think you should be on a course of antibiotics until the worst of it is healed to prevent anything from growing. a doctor can prescribe that, and can also show you how to do gauze changes that are less irritating.

i recommend a very thick occlusive to help trap in the moisture, plus gauze covering on the worst spots. i know, people think ""oh but it's so pore-clogging"" - doesn't matter, we're talking about the integrity of your skin tissue and making sure it retains moisture. if you let it dry out, it'll scar more prominently and could crack and split open since it's in the neck region, which has a lot of movement.

very regular/liberal dressing changes too. to make changing gauze less painful, dampen it with a bit of water before removing to help prevent the tissues and serosanguinous fluid from 'clinging' to the bandaging which can be painful.",110,1745800892.0,167,78
1k9d1q5,[Hair Removal] Chemical Burn from Nair!,mpdd0qa,"Ouch, you may want to see a doctor. You can start with antibiotic ointment and gauze dressing to keep it covered.",400,1745785478.0,167,78
1k9d1q5,[Hair Removal] Chemical Burn from Nair!,mpdkzvh,"Was this specifically for face? If it was, you might want to report it to them, as it maybe a faulty batch.",155,1745787911.0,167,78
1k9d1q5,[Hair Removal] Chemical Burn from Nair!,mpdy2k6,"I once used Nair on my armpits. I did NOT wash my pits before I applied the Nair, and there was still residue of deodorant from the day before. The chemical reactions from Nair & the day old deodorant caused a huge blister on my pits.",117,1745792170.0,167,78
1k9d1q5,[Hair Removal] Chemical Burn from Nair!,mpef1hg,La Roche Posay Cicaplast balm will help soothe and heal for sure. Regularly put some vaseline on as well,15,1745797958.0,167,78
1k9d1q5,[Hair Removal] Chemical Burn from Nair!,mpdyc7y,"Ugh that looks so painful! NGL, I’d probably hit up urgent care or see if I can get an emergency derm appointment if it were me. I’m so sorry this happened to you. 🩷

May I ask where you tested it? I try to test patch stuff for the face on the front of my neck (usually right below my chin as that spot is the most like my face skin) as my face is way more sensitive than any of the suggested test patch areas. It’s not as inconspicuous as other places, but it’s way more accurate for me and I’d rather deal with a small patch of a bad reaction than have it all over my face.",32,1745792260.0,167,78
1k9d1q5,[Hair Removal] Chemical Burn from Nair!,mpdj7fb,If you can’t go to a doctor: Aloe Vera and Zinc Oxide ointment.,44,1745787370.0,167,78
1k9d1q5,[Hair Removal] Chemical Burn from Nair!,mpe2xxy,"Instead of messing with our food, medicine, and sunscreen access, wish they'd finally ban Nair and approve new sunscreen filters.",39,1745793758.0,167,78
1k9d1q5,[Hair Removal] Chemical Burn from Nair!,mpef33z,"What to do right now (from someone who had a chemical burn a few months ago):
• Rinse with cool water for 10–15 minutes if you haven’t already.
• Use a cold compress on the area for 10 minutes at a time to soothe it.
• Apply burn gel (like one with lidocaine) or pure aloe vera gel to keep it cool and moist. DO NOT use Neosporin or an antibiotic cream until after your doctor’s visit. They can make it worse or further upset the burn. 
• Take ibuprofen if you can, for pain and swelling.
• Cover it up with gauze before you go to the doctor
• Keep it clean and don’t use any harsh products, makeup, or sunscreen on it yet.
• Avoid picking or touching the skin as much as possible.
• Stay out of the sun — if you have to go outside, cover the area with clothing (like a hat or scarf) instead of sunscreen for now. Sunscreen could make it worse while it’s an open wound.

When you get to the doctor, make sure you tell them if you have any pus or discharge, swelling, pain, fever, or skin color changes. 

I hope this helps! Please call Nair and let them know this happened, maybe they can do something?",19,1745797973.0,167,78
1k9d1q5,[Hair Removal] Chemical Burn from Nair!,mpe8c4c,They make a spray for burns that had lidocaine in it. I've done this and it's the only thing that helped. Buy two cans when you get it; chemical burns are a pita.,9,1745795607.0,167,78
1k9d1q5,[Hair Removal] Chemical Burn from Nair!,mpdv3np,"Just curious, do you use a retinol at all? Something similar with burns happened to me and it was because I use one, but it was when I tried waxing my upper lip.",14,1745791181.0,167,78
1k9d1q5,[Hair Removal] Chemical Burn from Nair!,mpesa85,Girllll this happened to me when I use Shea Moisturizer African black soap! I was a regular user then all of a sudden I got chemical burns. Best thing for you to do is mask up and head over to the urgent care. They will give you antibiotics and prescription skin medication for healing. Don’t wait it out like I did :(,3,1745802827.0,167,78
1k9d1q5,[Hair Removal] Chemical Burn from Nair!,mpeessp,"Since it's quite a large part of your face, I'd recommend seeing a doctor for it. Maybe a dermatologist if you have one you can go see soon. Especially since it's hurting a lot. You don't want it to scar or get infected",6,1745797874.0,167,78
1k9d1q5,[Hair Removal] Chemical Burn from Nair!,mpe7yed,"Aloe Vera, put something over it, and go to the doctor. This is horrifying but fixable. Definitely report it to the company.",3,1745795473.0,167,78
1k9d1q5,[Hair Removal] Chemical Burn from Nair!,mpf908v,"You should see a doctor since it's a chemical burn which on it's own has a high risk of infection on top of a zone that also has a high risk of getting infected, the doc should give you a prophylactic measure, besides that my tips would be:

Keep it clean, I believe you sould still be able to use your face wash if it doesn't burn more than water, avoid alcohol and hydrogen peroxide: alcohol dries the skin and inhibits healing (and burns like hell) and hydrogen peroxide messes with healing too, use hipoclorous acid (microdacyn is the most famous brand)

Use vaseline on it, if your face cream doesn't burn more than water you should even layer the vaseline on top of it, keeping the skin hydrated is important for healing and vaseline acts as a protective layer

Avoid the Sun and I'm not even sure you should be using sunscreen, ask that to the doctor, dermatologist if you can",3,1745809193.0,167,78
1k9d1q5,[Hair Removal] Chemical Burn from Nair!,mpg69yp,I would try Biafine (after consulting with a doctor).,2,1745826674.0,167,78
1k9d1q5,[Hair Removal] Chemical Burn from Nair!,mphu06s,"Honestly, you need to go to a doctor. Stat.

Any burn larger than three inches in diameter on the face should be seen by a doctor.

Wear a wide brim hat to go outside, do not put anything on your skin until the doctor has told you to. You can also call their office in advance and ask what you need to do in order to protect your skin until you can come in to see them.

ETA: and report the injury to both the company and the FDA. https://www.fda.gov/drugs/fdas-adverse-event-reporting-system-faers/fda-adverse-event-reporting-system-faers-public-dashboard",2,1745853303.0,167,78
1k7vzzq,[Humour] The serum I have been using is apparently loved by  ✨deramtologists✨,mp1eo9r,"



Are you brand new to skincare? Don't know how to build a skincare routine? The best place to start is our [ScA Routine](https://www.reddit.com/r/SkincareAddiction/wiki/sca_routine/)! 

You can find even more skincare guides [in our wiki!](https://www.reddit.com/r/SkincareAddiction/wiki/index). Your answer might already be in there (and if it is, we might remove your post).

Everyone is welcome in [this community](https://www.reddit.com/r/SkincareAddiction/wiki/about); remember to be kind and assume good faith :)


*I am a bot, and this action was performed automatically. Please [contact the moderators of this subreddit](/message/compose/?to=/r/SkincareAddiction) if you have any questions or concerns.*",1,1745615445.0,113,8
1k7vzzq,[Humour] The serum I have been using is apparently loved by  ✨deramtologists✨,mp2r97x,👁👄👁 oh no honey what is you doin,61,1745632090.0,113,8
1k7vzzq,[Humour] The serum I have been using is apparently loved by  ✨deramtologists✨,mp2fd5d,"Personally I’d be SO done with that, either the brand has really bad quality control on their packaging and I’d worry about the QC on the rest of the product, or it’s a counterfeit, etc…. But I also don’t buy skincare or even food from Amazon because I think it’s not trustworthy at all. 

This eclat website doesn’t look functional, another bad sign.",55,1745627824.0,113,8
1k7vzzq,[Humour] The serum I have been using is apparently loved by  ✨deramtologists✨,mp34w69,Deramtologists may love it but I bet Dermatologists hate it lol,20,1745637118.0,113,8
1k7vzzq,[Humour] The serum I have been using is apparently loved by  ✨deramtologists✨,mp3hxg2,It’s enhanced with science too,9,1745642686.0,113,8
1k7vzzq,[Humour] The serum I have been using is apparently loved by  ✨deramtologists✨,mp6qcvq,Everything is apparently loved by derms and clinically proven 😂,2,1745692108.0,113,8
1k7vzzq,[Humour] The serum I have been using is apparently loved by  ✨deramtologists✨,mpkm4gf,Amazon is known for selling fakes.  I would stay away from buying beauty products from Amazon.,1,1745884236.0,113,8
1kar02w,[product question] My lip cream arrived with a shipping label stuck right over the box. Is this common? My previous orders always had the products inside a box or bag,mpocogi,"



Are you brand new to skincare? Don't know how to build a skincare routine? The best place to start is our [ScA Routine](https://www.reddit.com/r/SkincareAddiction/wiki/sca_routine/)! 

You can find even more skincare guides [in our wiki!](https://www.reddit.com/r/SkincareAddiction/wiki/index). Your answer might already be in there (and if it is, we might remove your post).

Everyone is welcome in [this community](https://www.reddit.com/r/SkincareAddiction/wiki/about); remember to be kind and assume good faith :)


*I am a bot, and this action was performed automatically. Please [contact the moderators of this subreddit](/message/compose/?to=/r/SkincareAddiction) if you have any questions or concerns.*",1,1745941158.0,106,20
1kar02w,[product question] My lip cream arrived with a shipping label stuck right over the box. Is this common? My previous orders always had the products inside a box or bag,mpod58s,Love that you didn’t redact the NJ.  People need to know what you’re about.  Respect.,777,1745941291.0,106,20
1kar02w,[product question] My lip cream arrived with a shipping label stuck right over the box. Is this common? My previous orders always had the products inside a box or bag,mpohpcy,"I don't know where you bought this, but Prime defaults to minimal packaging which is sometimes an address label on the box.  No outer box minimizes the waste created by shopping online.  I am sure some other companies do it as well.",181,1745942602.0,106,20
1kar02w,[product question] My lip cream arrived with a shipping label stuck right over the box. Is this common? My previous orders always had the products inside a box or bag,mpos2gs,Was this a same day delivery item through a courier partner (e.g. DoorDash) or a shipped item?,24,1745945661.0,106,20
1kar02w,[product question] My lip cream arrived with a shipping label stuck right over the box. Is this common? My previous orders always had the products inside a box or bag,mpquxkl,"SIOC (ship in own container) is the goal of many CPG companies moving forward. 

Source: I’m a packaging engineer with a degree in Packaging",25,1745967757.0,106,20
1kar02w,[product question] My lip cream arrived with a shipping label stuck right over the box. Is this common? My previous orders always had the products inside a box or bag,mpohsqt,"This depends on the delivery partner.

I am in a different country and work for a company that provides delivery exactly like this - items are not in a box but just shipped as they are, with just a label with the recipient's name and address on top.

I.e. this is not a skincare question (it's a shipping / delivery service question).",28,1745942632.0,106,20
1kar02w,[product question] My lip cream arrived with a shipping label stuck right over the box. Is this common? My previous orders always had the products inside a box or bag,mpq1l0g,Happens with some things on Amazon (not sure where you ordered from). You have to click the box for “hide what’s inside - ship in Amazon package” vs “ship in manufacturer packaging”. Other places may be similar not sure.,2,1745958647.0,106,20
1kar02w,[product question] My lip cream arrived with a shipping label stuck right over the box. Is this common? My previous orders always had the products inside a box or bag,mpp4suh,It depends what courier they used to to deliver,3,1745949220.0,106,20
1kar02w,[product question] My lip cream arrived with a shipping label stuck right over the box. Is this common? My previous orders always had the products inside a box or bag,mptkmwx,"Did you order on Amazon? I am also in nj and recently received an item packaged in just the packaging, no outer box and the packaging box wasn’t even taped or sealed… first time this has ever happened 🤔",1,1746011947.0,106,20
1kar02w,[product question] My lip cream arrived with a shipping label stuck right over the box. Is this common? My previous orders always had the products inside a box or bag,mpseu8p,Not normal. Not safe. Don't use it. Return.,-2,1745988013.0,106,20
1k85d0a,[acne] help I want to get rid of this huge pimple under my nose without leaving a scar,mp3ln2f,"



Are you brand new to skincare? Don't know how to build a skincare routine? The best place to start is our [ScA Routine](https://www.reddit.com/r/SkincareAddiction/wiki/sca_routine/)! 

You can find even more skincare guides [in our wiki!](https://www.reddit.com/r/SkincareAddiction/wiki/index). Your answer might already be in there (and if it is, we might remove your post).

Everyone is welcome in [this community](https://www.reddit.com/r/SkincareAddiction/wiki/about); remember to be kind and assume good faith :)


*I am a bot, and this action was performed automatically. Please [contact the moderators of this subreddit](/message/compose/?to=/r/SkincareAddiction) if you have any questions or concerns.*",1,1745644537.0,102,65
1k85d0a,[acne] help I want to get rid of this huge pimple under my nose without leaving a scar,mp3m228," Get some spot treatment. Benzoyl peroxide, adapelene anything. Also, your skin is gorgeous 🫶",200,1745644757.0,102,65
1k85d0a,[acne] help I want to get rid of this huge pimple under my nose without leaving a scar,mp3pnoc,Tbh just came here for your routine cause your skin is gorgeous!,112,1745646720.0,102,65
1k85d0a,[acne] help I want to get rid of this huge pimple under my nose without leaving a scar,mp3n2r1,"Pimple patches. I’m a BIG fan of hydrocolloid patches in general, god they are a life saver. You want something to heal and heal well? Give it time, don’t pick at it, and those patches save my butt every time. I’ve even had LARGE spots, like body acne, the kind that comes up from a bra rubbing or what not, and I’ll use the heavy duty cushiony hydrocolliod bandages that are labeled often for cuts or blisters. NO MORE DARK SPOTS. Those kinds of sores used to always leave dark spots and scars. Now, they’re fully healed within a week or so. I’ll never go back.",130,1745645304.0,102,65
1k85d0a,[acne] help I want to get rid of this huge pimple under my nose without leaving a scar,mp3yjov,"I know it's tempting but DO NOT TOUCH IT. Don't pop it, massage it, feel it. Leave it be. If you feel like you can't, put on a pimple patch. 
Whenever you're manipulating a pimple you're making it and the skin around it more inflamed which will lead to damage.",28,1745651698.0,102,65
1k85d0a,[acne] help I want to get rid of this huge pimple under my nose without leaving a scar,mp3p1om,Your lip colour is so so pretty. Is it natural or did you use some tint?!,35,1745646386.0,102,65
1k85d0a,[acne] help I want to get rid of this huge pimple under my nose without leaving a scar,mp3p7p8,"Azaleic acid!! It’ll bring the redness down, help to speed up healing and skin cell turnover",13,1745646477.0,102,65
1k85d0a,[acne] help I want to get rid of this huge pimple under my nose without leaving a scar,mp3x2h0,Sulfur,9,1745650843.0,102,65
1k85d0a,[acne] help I want to get rid of this huge pimple under my nose without leaving a scar,mp3vt2a,whats your skincare routine like??? your skin looks too good,8,1745650126.0,102,65
1k85d0a,[acne] help I want to get rid of this huge pimple under my nose without leaving a scar,mp4dqxn,Lip color so pretty,3,1745660935.0,102,65
1k85d0a,[acne] help I want to get rid of this huge pimple under my nose without leaving a scar,mp50gey,"Whenever I’ve gotten those painful pimples in the same spot, I’d use a microdart pimple patch, and it would make healing a lot faster than a regular pimple patch. I use ZitSticka Killa microdart patches that deliver the skincare directly into the pimple itself. There are other brands you can try too. I liked the Hero Mighty Patch microdarts too since it had a ton of darts, but they didn’t go as deep as ZitSticka. 

And yes I’m also obsessed with your lil color! 😊",4,1745672130.0,102,65
1k85d0a,[acne] help I want to get rid of this huge pimple under my nose without leaving a scar,mp3te1m,Wait,3,1745648766.0,102,65
1k85d0a,[acne] help I want to get rid of this huge pimple under my nose without leaving a scar,mp3zh3o,"Which lip color is this? No offensive, natural color + texture?",3,1745652242.0,102,65
1k85d0a,[acne] help I want to get rid of this huge pimple under my nose without leaving a scar,mp3xlt0,Pimple patch,2,1745651150.0,102,65
1k85d0a,[acne] help I want to get rid of this huge pimple under my nose without leaving a scar,mp4ep6b,Pimple patch,2,1745661518.0,102,65
1k85d0a,[acne] help I want to get rid of this huge pimple under my nose without leaving a scar,mp3q1gn,Papay soap can be used in the face? I didn’t know that ,1,1745646927.0,102,65
1k85d0a,[acne] help I want to get rid of this huge pimple under my nose without leaving a scar,mp3qqx8,Lion pair works wonders,1,1745647309.0,102,65
1k85d0a,[acne] help I want to get rid of this huge pimple under my nose without leaving a scar,mp3wf06,I highly recommend PRIDs drawing salve for angry painful zits. It helps reduce the healing time significantly in my experience. I use it on zits and bug bites. It doesn’t smell great but doesn’t smell bad. I use it at night and then a pimple patch during the day to keep me from touching a blemish.,1,1745650472.0,102,65
1k85d0a,[acne] help I want to get rid of this huge pimple under my nose without leaving a scar,mp401zr,"Lil bit of face wash and some adapalene (i use differin) and you'll be right as rain.

The trick is to use just a lil bit, but do it EVERY NIGHT. (or every other, you look fair).",1,1745652584.0,102,65
1k85d0a,[acne] help I want to get rid of this huge pimple under my nose without leaving a scar,mp43xgl,"Try using a spot treatment with salicylic acid or benzoyl peroxide directly on the pimple. Avoid picking or squeezing it! Keeping the area clean and moisturized can also aid in healing. Your current routine appears gentle, which is good for preventing irritation.",1,1745654887.0,102,65
1kb798i,[B&A] - my skin has come a long way!,mps7hqt,"



Are you brand new to skincare? Don't know how to build a skincare routine? The best place to start is our [ScA Routine](https://www.reddit.com/r/SkincareAddiction/wiki/sca_routine/)! 

You can find even more skincare guides [in our wiki!](https://www.reddit.com/r/SkincareAddiction/wiki/index). Your answer might already be in there (and if it is, we might remove your post).

Everyone is welcome in [this community](https://www.reddit.com/r/SkincareAddiction/wiki/about); remember to be kind and assume good faith :)


*I am a bot, and this action was performed automatically. Please [contact the moderators of this subreddit](/message/compose/?to=/r/SkincareAddiction) if you have any questions or concerns.*",1,1745984767.0,86,13
1kb798i,[B&A] - my skin has come a long way!,mpt9dbp,"You didn’t just clear your skin you cleared your whole side quest. Absolute main character energy.

Seriously though, huge props for sticking with it. That glow is earned!",19,1746005860.0,86,13
1kb798i,[B&A] - my skin has come a long way!,mps9a3q,"very nice skin, what did you do, laser therapy? tretinoin?",5,1745985527.0,86,13
1kb798i,[B&A] - my skin has come a long way!,mpsp2mv,no botox?,2,1745993230.0,86,13
1kb798i,[B&A] - my skin has come a long way!,mptsnir,Looking great!,2,1746015336.0,86,13
1kb798i,[B&A] - my skin has come a long way!,mpttu5o,You look amazing!,2,1746015789.0,86,13
1kb798i,[B&A] - my skin has come a long way!,mptupnb,Hell yeah!!! I see the dedication and consistency friend,2,1746016122.0,86,13
1kb798i,[B&A] - my skin has come a long way!,mpu3now,I knew as soon as I saw this before opening the post Retinoids were involved.,2,1746019272.0,86,13
1kb798i,[B&A] - my skin has come a long way!,mps7hsh,"Hi there,

It seems like you may be looking for information about hyperpigmentation or post acne marks. Have you read our [hyperpigmentation wiki](https://www.reddit.com/r/SkincareAddiction/wiki/hyperpigmentation)?

*If you see that I am replying to something out of context (eg. listed in a routine), please report this comment so my handlers can remove it. Cheers!*


*I am a bot, and this action was performed automatically. Please [contact the moderators of this subreddit](/message/compose/?to=/r/SkincareAddiction) if you have any questions or concerns.*",1,1745984768.0,86,13
1k8na6x,[acne] almost 30 and my skin is awful,mp7k0pg,"



Are you brand new to skincare? Don't know how to build a skincare routine? The best place to start is our [ScA Routine](https://www.reddit.com/r/SkincareAddiction/wiki/sca_routine/)! 

You can find even more skincare guides [in our wiki!](https://www.reddit.com/r/SkincareAddiction/wiki/index). Your answer might already be in there (and if it is, we might remove your post).

Everyone is welcome in [this community](https://www.reddit.com/r/SkincareAddiction/wiki/about); remember to be kind and assume good faith :)


*I am a bot, and this action was performed automatically. Please [contact the moderators of this subreddit](/message/compose/?to=/r/SkincareAddiction) if you have any questions or concerns.*",1,1745701737.0,52,74
1k8na6x,[acne] almost 30 and my skin is awful,mp7mu4x,I tried all these things… low dose accutane was the craziest most amazing transformation. I wish more people would try it.,85,1745702690.0,52,74
1k8na6x,[acne] almost 30 and my skin is awful,mp7o5i6,"I tried 4 derms before the fourth one put me on accutane. Most derm clinics don’t even offer it (most derms are slightly annoyed by acne patients in general because they make so little money from treating acne vs doing other services). 

If I could go back and do it again I would sue the online accutane provider like Honeydewcare. I think that’s the name of one of them. You don’t have to do as many lab tests in person and it’s less expensive. I think everyone should at least try it. Accutane is just a clinically high dose of vitamin A. Antibiotics have have worse side effects profiles compared to accutane. Worth a try!

If you’re a woman though you have to wait 2 months before you can get your first dose because of the pregnancy testing. So I would say start today and get your appointments set up! You can always decide not to take it in 2 months but at least you’ve started the process and are giving yourself the option. It totally ch aged my life. Got ride of my mild rosacea and my mild hormonal acne. My huge nose pores are gone. It was just amazing and I can’t believe I didn’t think to try it until my 30s.",14,1745703135.0,52,74
1k8na6x,[acne] almost 30 and my skin is awful,mp7lfsx,i was in the same boat as you and the one thing that made a difference was washing my face with distilled bottled water. I turned out to have hard water and it was DESTROYING my skin. I noticed a difference within a week after struggling non stop for years and trying everything,41,1745702214.0,52,74
