post_id,post_title,comment_id,comment_body,score,created_utc,post_upvotes,post_comments
1ka48td,[Acne] Butt acne/folliculitis (help),mpj9dv4,"



Are you brand new to skincare? Don't know how to build a skincare routine? The best place to start is our [ScA Routine](https://www.reddit.com/r/SkincareAddiction/wiki/sca_routine/)! 

You can find even more skincare guides [in our wiki!](https://www.reddit.com/r/SkincareAddiction/wiki/index). Your answer might already be in there (and if it is, we might remove your post).

Everyone is welcome in [this community](https://www.reddit.com/r/SkincareAddiction/wiki/about); remember to be kind and assume good faith :)


*I am a bot, and this action was performed automatically. Please [contact the moderators of this subreddit](/message/compose/?to=/r/SkincareAddiction) if you have any questions or concerns.*",1,1745868497.0,369,228
1ka48td,[Acne] Butt acne/folliculitis (help),mpj9opn,I am following because i have the same issue,144,1745868589.0,369,228
1ka48td,[Acne] Butt acne/folliculitis (help),mpjdp6p,"Youre going to get a lot of different answers and I wouldn’t discount them. Like, for sure you could get swabbed for staph and you could try different medication/creams. But I just want to comfort you by saying that you should not feel any sort of “horror” from this issue. SO many people have butt acne. I’m not excluded from that statement. Butts go places the rest of us don’t (toilet seats, under heavy clothing that gets pressed up against them all day while we’re working, etc.) The skin there is delicate, but it doesn’t get the same attention as hands/faces so it often winds up breaking out. You shouldn’t feel any shame about it. Millions of butts look exactly like this. IMO, this isn’t even bad. It looks pretty standard to me lol. I have a pretty zitty ass because I sit all day and then I go to the gym. I have found some relief in frequent physical exfoliation with an African net sponge BUT there’s just some days my ass looks just like this and that’s pretty normal. Put that butt in a bikini and go enjoy life. 

Also, whoever downvoted this post is an ass. Full pun intended

Edit: forgot to say that the ordinary glycolic acid also seems to help my assne. I also wash with cerave",999,1745869819.0,369,228
1ka48td,[Acne] Butt acne/folliculitis (help),mpjkaul,"The only thing that worked for me was Panoxyl max strength (10%, apply prior to shower and leave on for a few minutes before rinsing off), followed by salicylic acid solution and AmLactin cream after shower. When I stick to this regimen, my bumps get sooo much better!",103,1745871798.0,369,228
1ka48td,[Acne] Butt acne/folliculitis (help),mpjn6cm,"I just want you to know this is SO common and I eventually realized that men/people do NOT actually notice it at all like you might think while in a sexytime scenario- like they don’t even see it, they just see your beautiful butt/body. Truly.  I do t have advice but some of these other girls do and I hope it helps, but at least as far as feeling mortified; no one here in this non-sexy part of the world cares or finds it horrible looking like you do, and the vast majority of people who will see you in person with your clothes off will literally not see it. 
   (That said, if you know you may be hooking up and have a flare up that’s pretty red/visible you can use makeup like you would on a red spot on your face if it helps you feel better in the moment, though!)",49,1745872646.0,369,228
1ka48td,[Acne] Butt acne/folliculitis (help),mpjrt9y,"Fellow butt pimple person here, you’re not alone!

ps, I made this account many years before I ever experienced my first butt pimples 🥲",33,1745874042.0,369,228
1ka48td,[Acne] Butt acne/folliculitis (help),mpjfpfv,"HEAR ME OUT - go back to the benzoyl peroxide, but LEAVE IT ON FOR AT LEAST 5 minutes!!!!!!! That has been the game changer for me! Give it a chance to work and kill the bacteria on the skin that is causing the acne!",61,1745870421.0,369,228
1ka48td,[Acne] Butt acne/folliculitis (help),mpjcj36,"cut down on the physical exfoliation, get off your ass during the day as much as possible (no, not exercise for 30m a day, literally just dont sit down a lot), see if the material of your underwear is causing it (could be synthetic). Also, address anything that might be causing hormonal imbalances, because this can be indicative of it.

Your shower routine should now look like this (excluding hair washing and stuff):

1. get wet with lukewarm or cool water, not hot water, and get properly wet not just rinsing
2. use a bar soap that is NOT antibacterial. antibacterial soaps are shit for your skin and will do more harm than good. Additionally, normal soap suffices and is exactly the same. Get dove bar soap or something
3. rinse off soap
4. use a chemical exfoliant, NOT a physical exfoliant like a scrub or a loofah or whatever. obvs use a washcloth elsewhere, but avoid acne areas
5. rinse off, dry off, use a toner OR witch hazel, let it sit til completely dry
6. moisturise
7. wear loose clothing or entirely omit underwear for a while. Personally I sleep naked so that helps.

Good luck.

Edit: sent without finishing post",63,1745869464.0,369,228
1ka48td,[Acne] Butt acne/folliculitis (help),mpjuam0,"I used to do porn so I needed my butt to look perfect so I used retinal at night and salicylic acid during the day like a face regimen. Worked pretty quick for me (along with cotton underwear, regular mild exfoliation and good moisturiser habit)",22,1745874821.0,369,228
1ka48td,[Acne] Butt acne/folliculitis (help),mpjnmqd,"Eek that big one looks *painful*! I urge you to see a dermatologist about this if only because:

While folliculitis on the butt is extremely common, it also *could* be something infectious and treatable. 

My personal story: I was blessed with body acne along with my face acne. It all cleared up when I did accutane, but some time after, it came back… only on my butt. A place I hadn’t had it before (chest and upper back were my worst zones). I thought it was due to my chosen methods of hair removal (shaving, waxing, and/or epilation), so I did laser hair removal and electrolysis on whatever would take but I still do have fine peach fuzz everywhere. It improved marginally, if at all. I kind of just *dealt* and then after a filthy fucking outdoors event that left us all completely covered in noxious smelling mud, it got worse. In addition to more pustules than usual, my whole bottom was red and itchy, so I mentioned it to my dermatologist. She gave me a topical cream (I believe it was gentamycin edit: or it could have been mupirocin?), but it didn’t help, or not enough, so then she prescribed me an oral antibiotic (keflex?). That did the trick. I finished out the course and not only did it clear up the red itchy eruption, but even the regular folliculitis/acne never came back. And I mean never. It has been like 8 years now. I find myself wonder if it isn’t possible I was colonized by a milder staph or something similar for a long time, and then the mud run had a nastier variety edge out what had been there, and then the antibiotic took care of it.

I am not trying to diagnose you or make any promises, I’m merely suggesting that, while you’re getting actionable home remedies here, it wouldn’t hurt to see a professional!",16,1745872783.0,369,228
1ka48td,[Acne] Butt acne/folliculitis (help),mpjol4h,"Same. I wear compression shorts for martial arts training and tighter running pants (like yoga pants) for running. I get it on my butt, hips, outer thighs. 


Finally went to dermatologist. 


Chlorhexidine gluconate 4% (brand name is hibiclens, but you can get the generic dye free kind without the pump at any pharmacy in the shelf) is what I use during every shower (i shower once, sometimes twice a day). 


It took about two, almost three months of regular use to really clear up. 


Avoid exfoliating until it's cleared up or it makes it worse! That includes AHAs, BHAs, the KP scrub, manual exfoliating, all that! 


Once it's cleared up and you have no active breakouts, do the exfoliating treatments to treat the scars and discoloration. I'm in the exfoliating stage now. ",16,1745873069.0,369,228
1ka48td,[Acne] Butt acne/folliculitis (help),mpje4ee,Try azelaic acid and then something to unblock the pores like a retinoid or lactic acid,11,1745869947.0,369,228
1ka48td,[Acne] Butt acne/folliculitis (help),mpjakub,Hibiclens solved this issue for me.,38,1745868865.0,369,228
1ka48td,[Acne] Butt acne/folliculitis (help),mpk34ei,I use Stridex pads in the red box for this.,8,1745877751.0,369,228
1ka48td,[Acne] Butt acne/folliculitis (help),mpkta0j,"It’s not acne, it’s folliculitis. Use Hibiclens in the turquoise bottle. It’s a bright pink clear liquid. Apply a generous amount. Leave on as a mask for 10 min before your shower. Do this every day until it goes away, and maybe for a couple days after. When it comes back, do it again.",8,1745886735.0,369,228
1ka48td,[Acne] Butt acne/folliculitis (help),mpjca69,"I get it on my thighs as well. I used The Ordinary Brand Salicylic Acid 0.5% Body Serum after showering and feel it helped lessen it. Should go see derm though as I’m thinking it must be a skin infection as I’ve also always had it my whole life, despite being a very hygienic person.",6,1745869389.0,369,228
1ka48td,[Acne] Butt acne/folliculitis (help),mpjlipv,"1. I would lay off physical exfoliants, and make sure you’re cleaning your skin with a good sweat removing first wash, then do your body wash.
2. Add in your BP wash but let it sit for 5-7 minutes while you wash the rest of your body. It doesn’t do anything for me when I rinse it off quickly.
3. I would add using a hypochlorous acid spray before you work out! I do this on my chest to reduce the amount of acne I get overall and it has helped dramatically! I use the Prequel one and some generic one I got at Walgreens (they’re the same active strengths)",6,1745872156.0,369,228
1ka48td,[Acne] Butt acne/folliculitis (help),mpjxjvf,"I struggled with this too. I’m not “cured” but most of my problem was residual shampoo/conditioner running down my back. I am diligent about my back and butt being the last thing I wash, usually with salicylic acid face wash",6,1745875858.0,369,228
1ka48td,[Acne] Butt acne/folliculitis (help),mpjyrum,"Hibiclense, no synthetic fibered undergarments and changing as soon as possible anytime I sweat, making sure I washed my body after conditioning my hair, and quickly wiping down the toilet seat daily helped tremendously. Still working at minimizing the hyperpigmentation but no active bumps.",5,1745876252.0,369,228
1ka48td,[Acne] Butt acne/folliculitis (help),mpkt1x7,"I just want to say a huge thank you to everyone who replied here!
I honestly didn’t expect so many people to be so kind and supportive.
I’m reading through every response, even if I can’t reply to everyone individually, I’m really grateful for every single one of you who took the time to share advice or leave some kind words.
It’s already helping me feel a lot less alone with this and a lot more hopeful 😅 ! 
Thank you all so much!",7,1745886655.0,369,228
1k9i6lb,[personal] I completely ruined my skin and hate myself self now,mpefzo0,"



Are you brand new to skincare? Don't know how to build a skincare routine? The best place to start is our [ScA Routine](https://www.reddit.com/r/SkincareAddiction/wiki/sca_routine/)! 

You can find even more skincare guides [in our wiki!](https://www.reddit.com/r/SkincareAddiction/wiki/index). Your answer might already be in there (and if it is, we might remove your post).

Everyone is welcome in [this community](https://www.reddit.com/r/SkincareAddiction/wiki/about); remember to be kind and assume good faith :)


*I am a bot, and this action was performed automatically. Please [contact the moderators of this subreddit](/message/compose/?to=/r/SkincareAddiction) if you have any questions or concerns.*",1,1745798296.0,307,122
1k9i6lb,[personal] I completely ruined my skin and hate myself self now,mpetqrz,"Hey OP. I remembered seeing your post the other day on this, and can see you posted it several times in the last week.

So I get the impression this is something that's really panicking you and that you're fixating on. I feel for you, because I've been there. 

You've received hundreds of replies with really good advice and re-assurance - take a deep breath, read them, and know it's going to be ok!

You also uploaded a picture of your skin before, and as others commented it definitely doesn't appear to look the way you're describing in that photo, and as it looks to you. I know that maybe doesn't help with how it feels to you, but it's true. 

I'm not saying this to invalidate you, but I'm concerned about you feeling you've permanently damaged your skin/are afraid to look in the mirror. I'm also concerned that you may be obsessing over this, and are at risk of doing too many things to it now due to the belief you need to ""fix"" it. Like I said, I've been there before and I didn't need to be. 

Is seeking a dermatogist an option for you, perhaps to see if hearing this guidance from a professional can re-assure you more/help with some of the fear, as well as the issues you're describing? As someone who used to have quite an unhealthy fixation on my skin/parts of my body, and this idea I needed to ""fix them"" all the time, I think that could help you. I suspect some of this might be psychological <3


It's going to be okay",1402,1745803370.0,307,122
1k9i6lb,[personal] I completely ruined my skin and hate myself self now,mpejy1x,Your skin will regenerate. Leave it alone. Well I mean it will regenerate if that's as far as the damage went. If it went below the hypodermis you definitely need to see a dermatologist. I don't think you have anything to worry about It's not as bad as you think,142,1745799748.0,307,122
1k9i6lb,[personal] I completely ruined my skin and hate myself self now,mpeo8pm,"I think all skincare problems can be improved by restoring your barrier. It sounds like you need to nurture your barrier and drop all actives for a while. I would introduce a gentle cleanser, a hydrating toner and serum with no actives, and aestura 365 cream or zeroid soothing cream. Layer on the hydrating toners bc your barrier desperately needs humectants; they make up for TEWL. Something like mixsoon glacier water layered 3x can turn your skin around overnight if sealed in with a moisturizer.

Also, I *highly* recommend badger baby diaper rash cream. It is some kind of magic ointment that can improve your skin overnight. The zinc, sunflower oil, and calendula does an amazing job at soothing and shutting down redness and healing. 

Just use these products for about 3 weeks—no actives—and your skin should show some noticeable improvement.",91,1745801324.0,307,122
1k9i6lb,[personal] I completely ruined my skin and hate myself self now,mpesxnd,"Though I have “normal” but highly sensitive skin, I’ve been in a similar predicament. First, STOP all usage of facial products. I’m serious. None. Use a little warm water to “wash” your face and leave it alone. Skin will naturally heal from abrasive products. Next, start testing different products to get your skin back in shape in the lightest way possible. I use Cerave Facial Cleanser day and night. It’s super light and feels like a lotion. It’s non-irritating and I have severely sensitive skin. I also use Cetaphil products because they’re great for sensitive skin. Anything else makes my face turn red and into a monster from the chemicals. But be careful with “all-natural” products. Many are natural, but then add irritating essential oils, etc… I also only use unscented products from my facial cleaners to serums to moisturizers. You have to test a couple brands to find the right ones. 

Worst case scenario and that doesn’t help, I’d just go see a Dermatologist for additional help. I hope this helps!",13,1745803070.0,307,122
1k9i6lb,[personal] I completely ruined my skin and hate myself self now,mpek8c9,"Definitely sounds like you went a little bananas with the harsh products and destroyed your skin barrier! 
My skin is reactive but typically clear but last winter my skin was beat and dry from wind burn. Sometimes when it gets so sensitive and dry it will start overproducing oil to try to compensate, which then clogs your pores. Truely the worst of both worlds! Luckily you can do some work to repair your skin barrier and it should eventually find it’s normal again. 
You have the right idea by stopping all unnecessary products. Even things your skin can usually tolerate might be too harsh for your skin right now. If you’re not already, I’d start by only cleansing at night with something very gentle like neutragenas ultra gentle cleanser. Then I’d do a thicker moisturizer for overnight just to promote hydration and get your skin too hopefully cool down on the oil production. Cera Ve overnight cream is a cult classic. Then on the especially dry and irritated bits apply some kind of occlusive to keep the moisturizer from evaporating and give it more time to nourish those sensitive spots. Vaseline works but I particularly like egyption magic. It’s on Amazon and it’s a basically coconut oil with a lot of bee products that are naturally anti bacterial and very soothing. Skip cleansing in the morning. If your face feels oily in the morning, just give it a little rinse with water. Then apply a soothing moisturizer without any fragrance and a sunscreen. The sunscreen will help prevent the sun from irritating it more as well as a lot of other benefits. Once your skin has recovered and is less irritated I’d get a deep cleansing facial just to get the remaining junk out of the pores. Wait until it’s significantly less irritated though, you don’t want someone to be pushing and prodding on it while it’s trying to heal or accidentally applying something that’s just too harsh on your skin right now. 
In my case is was a solid 4-6 months before my skin felt completely normal again. Which is definitely hard. But it left me with a whole new thankfulness for my skin and a healthy fear of slathering on a new product just for the hell of it. Remember this won’t last forever! Your skin barrier will heal! Just be patient, consistent and kind to your skin and go easy on the abrasives from now on. Good luck!",9,1745799851.0,307,122
1k9i6lb,[personal] I completely ruined my skin and hate myself self now,mpice1d,I’m honestly shocked you got advice in this subreddit. Usually people just say the OP is normal and to just make yourself be happy about it. Good thing you didn’t post a picture or I think this is what would have happened. This place can be weird like that.,5,1745858773.0,307,122
1k9i6lb,[personal] I completely ruined my skin and hate myself self now,mpek2yh,The same thing happened to me but it was because i developed psoriasis on my face when i was 21 and the dermatologist gave me a cortisone cream to use all over twice a day and i had no clue that steroids can damage your skin so i kept using that cream for over a year and then my once perfect skin started getting premature wrinkles and large clogged pores and dehydrated and sensitive all the time,4,1745799796.0,307,122
1k9i6lb,[personal] I completely ruined my skin and hate myself self now,mpir28e,Could it be that what you’re experiencing is natural ageing? I too had good skin till I was 25 and then suddenly in a few months it got progressively bad..nothing to blame there tbh.,5,1745863009.0,307,122
1k9i6lb,[personal] I completely ruined my skin and hate myself self now,mpfmxsd,"Baby washcloths. I was doing all the stupid Korean double oil cleanse shit, slugging... my skin was like _wtf why are you doing this to us? We can sleep with makeup but this is too much_ lol milia and eczema or something. Idk. I still use cerave cleanser in the shower but as far as like end of the day routine, I just use these stupidly simple wash cloths and water, then hyaluronic acid and moisturizer. You didn't ruin anything it just sucks falling for the gimmicks. I don't have the energy for all those steps anyways. But the baby wash cloth suggestion was a good one for me. Way better than the microfiber towel things too.",6,1745815446.0,307,122
1k9i6lb,[personal] I completely ruined my skin and hate myself self now,mpfdwat,"hi OP, i don’t usually comment but i’ve seen the photos you posted, been exactly where you are and i know how it feels. disclaimer: this is my (extremely specific) journey and what worked for me won’t work for everyone.

i had perfect skin since young as well, matte, no pores, no hyperpigmentation, no texture, smooth like a peeled egg. everyone would compliment me and it was one of my defining “traits”. it was on the dry side though (never had a pimple) so i only used cleanser once a day. two years ago i started to incorporate skincare products for the first time (toner, serum, moisturiser) and ended up with itchy clogged pores, tiny bumps all over and red patches. i started using salicylic acid and other exfoliants, thinking it would get rid of it, but all it did was damage my skin barrier even more. it was a constant cycle of thinking this new product would help, trying it, getting opposite results, stop everything, trying another new product, getting opposite results again, stopping it. it felt like all hope was lost, there was no end in sight and i would never get my old skin back. i would look in the mirror everyday first thing in the morning and cry. bright lighting became my enemy. i lost all my confidence and hated myself for ever touching skincare and ruining something that didnt need improving in the first place. people around me did notice that my skin was worse, even though they assured me that this was still how most normal people’s skin looked. but it still affected me so much, because it just was not my skin before. eventually i took a long break from work (i had a job that required me to wear makeup everyday and irregular sleeping hours, making it impossible for my skin barrier to regenerate) and stayed at home in darkness with the curtains drawn, nothing on my face, washing with only water at night, drinking plenty of water and sleeping by 10pm everyday. i was just so scared to try any new skincare products for fear of it becoming worse. after 3 months, my skin had improved significantly in terms of redness but still felt flaky, dry and tight. so i started to incorporate the la mer moisturiser - i know people shit on it but i do have a history of eczema and it genuinely worked for me. i won’t be using skincare from other brands anymore (this is coming from someone who has tried over 30 moisturisers, lol). eventually i incorporated other la mer products as well - like the concentrate - and my healing process has been really fast. it’s been about 6 months now. apart from 3 small hyperpigmentation spots on my left cheek, i would say that my skin is 95% back to how it was before.

tldr; skincare products work differently for everyone but i hope you find what works for you. above all else, prioritise your skin barrier. if what you say is true, your base is already good so you just have to let time do the healing. it won’t be like this forever. and in the meantime, remember that your skin does not define you. i know it’s easier said than done (i’ve experienced it firsthand), but try not to let it stop you from living your life. i would constantly cancel appointments with friends due to my skin and it’s just not worth it… spend time with those who love you and eventually everything will sort itself out. stay strong OP, sending you encouragement and best wishes. let me know if you have any other questions, i’d be happy to answer.",3,1745811252.0,307,122
1k9i6lb,[personal] I completely ruined my skin and hate myself self now,mpfzgcb,"Like others have said, it really just sounds like you disrupted your skin’s moisture barrier. The barrier will replenish itself over time and your skin will heal. You’re doing the right thing by paring back your skincare and keeping it simple and non-irritating. If you add anything else to your routine, focus on gentle hydrating products, but don’t go overboard. It will be okay, it will just take a little time.",3,1745822348.0,307,122
1k9i6lb,[personal] I completely ruined my skin and hate myself self now,mpgw5q8,"I went through a similar thing, and I know how hard it is. I had flawless, glowy skin as a teen. I developed severe cystic acne in my mid 20s and have a substantial amount of different kinds of scarring that likely will never go away. Even celebrities like Megan Fox, who can afford any kind of work, can't totally defeat their scarring. It'll never be like it was, but I'm doing the best I can and am very happy with my progress. I try not to compare myself with the before-before but the before, if that makes sense. 😂",3,1745841564.0,307,122
1k9i6lb,[personal] I completely ruined my skin and hate myself self now,mpeiyqh,"25 year old woman here.  Exact same boat—my heart goes out to you.  It’s hard knowing we did it to ourselves and this could all have been prevented.
My advice would be to save up and do some sort of laser resurfacing at a dermatologists’ office.  Never give up hope that there is a way to heal ❤️",5,1745799386.0,307,122
1k9i6lb,[personal] I completely ruined my skin and hate myself self now,mpem12c,You mentioned cleanser and moisturizer but make sure you’re also using sunscreen. Maybe vitamin E oil can also help.,2,1745800505.0,307,122
