post_id,post_title,comment_id,comment_body,score,created_utc,post_upvotes,post_comments
1k8na6x,[acne] almost 30 and my skin is awful,mp7ri77,"I don't see a lot of acne on your face at all.  I do see what looks like flat moles, or cafe au lait spots, or PIH from past acne.  FWIW, OTC Differin adapalene is kind of weak - if tret isn't cutting it for you, try Rx adapalene in the max strength.  I think it's like .3%.  

Or you could try a combo tx - like BHA plus the retinoid, sulfur plus the retinoid, etc.  

Some people also find that cerave moisturizers break them out.  You could try changing your moisturizer to something like LRP Toleriane Mat (NOT the regular one), or Clean & Clear Moisturizer w/ 0.5% BHA, or LRP Effaclar Duo+M moisturizer (NOT the 5.5% BP lotion; you may need to order online from Europe to get this), Avene's Cleanance mattifying moisturizer for acne prone skin,  etc.  

Low dose accutane is another possibility.  

If it's the moles /dark spots tho that are really what's bothering you, then all the acne txs in the world won't help.  You may need mole removals or some other procedure.  Ask your derm specifically about the spots that bother you.  Mole removal can, unfortunately, result in scarring, so if that's the issue, you may only be able to remove some, not all, of the spots.",17,1745704257.0,52,74
1k8na6x,[acne] almost 30 and my skin is awful,mp7n5e0,"I am a firm believer in accutane. I had very similar acne in my teens/20s. I started accutane probably around age 24/25 and my skin has never been better since! I’m 32 now, just occasional jaw line acne that’s hormonal. I was telling my husband, at the time boyfriend, to go on it as well because of how amazing it was. He didn’t go on for another 1.5-2 yrs later and his response “I wish I had done it sooner”. I had tried everything prior to that. Wasted so much money on different products that didn’t work. That was the only permanent fix.",7,1745702796.0,52,74
1k8na6x,[acne] almost 30 and my skin is awful,mp7nx9t,I’m in the EXACT same spot and I’ve reached the end of my rope- nothing is making an improvement and it’s killing my mental health. I think I’m going to try accutane.,11,1745703058.0,52,74
1k8na6x,[acne] almost 30 and my skin is awful,mp7txg2,"I second what other people have said about hard water. When I lived in California my skin was constantly dry and red, hair dry etc. I would use distilled water only on your face, tazarotene (tret didn’t work for me either) and a simply but powerful skincare routine of cleanser - serum - moisturizer. Good luck, I really feel your pain.",5,1745705081.0,52,74
1k8na6x,[acne] almost 30 and my skin is awful,mp7o7q4,"I also have PCOS and used tret and differin without success. Spiro helped prevent some cystic acne around my chin, but wasn’t a total fix either. Differin may work for you - it will take over a month to see results. If it doesn’t, I highly recommend tazarotene. In less than two months my skin transformed to the clearest it’s ever been. I wish I’d tried it sooner.",3,1745703156.0,52,74
1k8na6x,[acne] almost 30 and my skin is awful,mp7sid7,Tretinoin and Adaplene don’t work for 100% of people. It looks like you need to take it a step up to Tazarotene,4,1745704603.0,52,74
1k8na6x,[acne] almost 30 and my skin is awful,mp7v2h2,Have you thought about Accutane. It helped me a lot. Just be sure you understand all the details and pros and cons.,3,1745705463.0,52,74
1k8na6x,[acne] almost 30 and my skin is awful,mp7qa1d,"After you wash your face, I’d use a salicylic acid serum. Specifically the bha one from Paula’s choice! Also those sunscreens made me break out so did elta MD so bad! I use mad hippie sunscreen serum now.",2,1745703844.0,52,74
1k8na6x,[acne] almost 30 and my skin is awful,mp7u6he,"Unfortunately, I don’t have any advice but I came here to say how cute your earrings are!! Where’d you get them from?",2,1745705165.0,52,74
1k8na6x,[acne] almost 30 and my skin is awful,mp847er,"I could have written this, I empathize with you

I’m 30, about to turn 31, and have had 4 rounds of accutane in addition to every topical under the sun. Spironolactone lowered my blood pressure too much so I had to stop it. My 71 year old father still gets acne, so I know the genes I have are fighting me tooth and nail and that this will be my life.

I noticed starting at 29 that things were getting worse again. I got a PCOS diagnosis, and trialed lots of different birth controls. I am by no means acne free, but I feel like I currently have it under control with only one small breakout around my period.

What worked for me was trialing different birth controls and a long consistent dose of minocycline. I also drink spearmint tea a few times a week, and see a dermatologist and obgyn semi regularly. I’m now on a long term low dose of minocycline. I also use a topical compounded spironolactone (brand name Winlevi) to reduce sebum production and topical called Aklief that is gentler than tret. 

All I can say is that I understand your pain. It’s exhausting to fight with your skin and your body. My derm comforted me a little by reminding me that the body goes through hormonal shifts as we age and that symptoms might be worse during these times. I hope you are able to find some hope in this comment section!",2,1745708607.0,52,74
1k8na6x,[acne] almost 30 and my skin is awful,mp86gga,"FWIW, supergoop broke me out and didn’t seem to provide very good protection (got several sunburns with it in situations I never did with other products).",2,1745709383.0,52,74
1k8na6x,[acne] almost 30 and my skin is awful,mp8fohi,"Biggest lie we were ever told is that acne and pimples is part of being a teenager ‘and will pass’ lol.

I’m 32 and also struggle with acne linked to my menstrual cycle. And I do not have PCOS.",2,1745712704.0,52,74
1k8na6x,[acne] almost 30 and my skin is awful,mp9azbx,"Hey I had the same issue- was also on 150 spiro and had tried everything except accutane. My acne is hormonal, so basically my derm said accutane would work and then eventually my hormones would mess my face up again. Now i'm using a gel called cabtreo and my face literally cleared up in a week. It's a mixture of clindamycin, adapalene, and benzoyl peroxide (all of which i'd used separately before) but I guess something about them together is like a secret sauce",2,1745725005.0,52,74
1k8na6x,[acne] almost 30 and my skin is awful,mp9w4ql,"35 here. Full pizza face as a teen, went on full strength rounds of Accutane three times from the age of 17 to 26. It really killed my body and skin during the process and made it so frustratingly dry. My skin looked good after.... for a year or two. Always came back. Tried every wash and topical. Every..... 
Now?
I'm on a low dose of Accutane and it's been life changing. 
I currently take 10mg two to three times a week and sometimes I forget. Ive stopped using SA and BP and all the creams and nonsense. I just wash with a delicate cleanser and use a cerave moisturizer and I add some rosehip oil. 
My skin has never looked better. I'm literally glowing sometimes (the rosehip oil). My depression from acne related issues is gone. Game changer.",2,1745735892.0,52,74
1k8na6x,[acne] almost 30 and my skin is awful,mpbdwvf,The IPL laser changed my life,2,1745763474.0,52,74
1k8na6x,[acne] almost 30 and my skin is awful,mpcimv7,"Biggest 2 recs I can make from someone(31) with PCOS and growing up with cystic acne, 1. a silk pillowcase (blissy is my preferred) just with that change, my skin cleared up drastically. 2. Using a moisturizer that is water based instead of a cream is life changing. I made the switch with these two things and my skin has never been clearer. I use the clinique moisture surge (gel not cream). I tried so many topical ointments, and they would never improve my skin even after months or years of being on them.",2,1745776079.0,52,74
1kbh7js,[Sun Care] Recent U.S. sunscreen launches: Allow me to de-influence you,mpuam29,"



Are you brand new to skincare? Don't know how to build a skincare routine? The best place to start is our [ScA Routine](https://www.reddit.com/r/SkincareAddiction/wiki/sca_routine/)! 

You can find even more skincare guides [in our wiki!](https://www.reddit.com/r/SkincareAddiction/wiki/index). Your answer might already be in there (and if it is, we might remove your post).

Everyone is welcome in [this community](https://www.reddit.com/r/SkincareAddiction/wiki/about); remember to be kind and assume good faith :)


*I am a bot, and this action was performed automatically. Please [contact the moderators of this subreddit](/message/compose/?to=/r/SkincareAddiction) if you have any questions or concerns.*",1,1746021537.0,56,8
1kbh7js,[Sun Care] Recent U.S. sunscreen launches: Allow me to de-influence you,mpugdco,"The coppertone every tone face products are so thick and greasy. I feel like I’m pumping straight silicone onto my skin. I think they changed the packaging recently so I mistakenly picked it up for a second time. It has the texture of a silicone makeup primer, but the amount you would need for actual sun protection far exceeds what you’d actually want for a primer so you just have a thick coating on your face meaning any makeup on top will easily shift and slide around. In an effort to use it up; I have taken to using a pea sized amount as a makeup primer. It does work really well for this if you use the tiniest amount possible - but that also means needing to use another product underneath for your actual sunscreen + makeup that will play nicely with the silicone so it’s still more effort than it’s worth.",5,1746023306.0,56,8
1kbh7js,[Sun Care] Recent U.S. sunscreen launches: Allow me to de-influence you,mpum4u5,"Thanks so much for this! The Trader Joe’s is disappointing. I was hoping they’d come out with a mineral formula that was a good one. 

I’m currently using Coppertone Oil Free + Shine Control SPF 45 Face Lotion and it’s pretty decent. It dries down clear on me (but I’m pretty pale), isn’t greasy, and most importantly does not break me out. It’s a decent primer, too. And I can’t “feel” it on my face. I don’t notice it being to heavy, but I also use a powder foundation, so that might be why! 
I have a whole drawer full of rejects. My face hates 99% of sunscreen formulas on the market. I thought I had to have a mineral formula, but it turns out niacinamide was in a lot of the chemical formulas I was trying and that seems to be what’s causing most of my breakouts. I’m still on my first bottle, so we’ll see how it goes.",3,1746025006.0,56,8
1kbh7js,[Sun Care] Recent U.S. sunscreen launches: Allow me to de-influence you,mpub91k,Thanks!,2,1746021738.0,56,8
1kbh7js,[Sun Care] Recent U.S. sunscreen launches: Allow me to de-influence you,mpuoy4a,"I love Hero Cosmetics Force Shield SPF 30. 100% mineral with a slight green tint to offset redness from acne prone skin. Also very light and breathable on the skin. I do wish it had higher SPF, but I don’t mind reapplying  as needed to stay sun safe.",1,1746025831.0,56,8
1kbh7js,[Sun Care] Recent U.S. sunscreen launches: Allow me to de-influence you,mpuvnfs,"I like Hawaiian Tropic weightless hydration and Neutrogena Rapid Wrinkle Repair for daily use. They’re both SPF 30. The HT is more hydrating. Neutrogena Sport Face SPF 70 is the best on the market for when I need something heavy duty, like at the beach or skiing.",1,1746027767.0,56,8
1kbh7js,[Sun Care] Recent U.S. sunscreen launches: Allow me to de-influence you,mpv0jut,You just reminded me to order another round of Beauty of Joseon through a Korean distributor.,1,1746029185.0,56,8
1k8mm5n,[Hair Removal] How to make shaving *down there* more bearable?,mp7eemy,"



Are you brand new to skincare? Don't know how to build a skincare routine? The best place to start is our [ScA Routine](https://www.reddit.com/r/SkincareAddiction/wiki/sca_routine/)! 

You can find even more skincare guides [in our wiki!](https://www.reddit.com/r/SkincareAddiction/wiki/index). Your answer might already be in there (and if it is, we might remove your post).

Everyone is welcome in [this community](https://www.reddit.com/r/SkincareAddiction/wiki/about); remember to be kind and assume good faith :)


*I am a bot, and this action was performed automatically. Please [contact the moderators of this subreddit](/message/compose/?to=/r/SkincareAddiction) if you have any questions or concerns.*",1,1745699928.0,44,50
1k8mm5n,[Hair Removal] How to make shaving *down there* more bearable?,mp7qqe3,"This might not apply to you, but I stopped bothering with shaving completely clean and instead use a trimmer. I have zero irritation now, and the trimmer cuts pretty close. There’s definitely stubble left over, but it’s just long enough to not be sharp and irritating but still pretty smooth. I figured even if this isn’t helpful for you it might be helpful for somebody else who sees this!",271,1745703999.0,44,50
1k8mm5n,[Hair Removal] How to make shaving *down there* more bearable?,mp7wfy5,The way I vomited when I tried to epilate 😂☠️,71,1745705941.0,44,50
1k8mm5n,[Hair Removal] How to make shaving *down there* more bearable?,mp8b1ah,"Shaving with (instead of against) the hair growth direction does wonders. I also use tea tree oil lotion afterwards. And (gently) exfoliating is supposed to help with issues like ingrown hairs and such as well.

For anyone reading this, this advice is strictly applied to the mons pubis, you do not want to exfoliate or get lotion on your bits, especially with tea tree oil otherwise you get an experience which I can only describe as ""imagine if your vulva had chewed menthol gum"".",32,1745710988.0,44,50
1k8mm5n,[Hair Removal] How to make shaving *down there* more bearable?,mp7jniv,"hot steamy shower for at least 5-10m. exfoliate with a glove and physical exfoliant. 5 blade NEW razor, shaving cream. clean the blade frequently during the shave w water to keep it clear 

pull your skin taut, shave in one direction. if your skin is too sensitive, don't go over an area with the blade more than 2-3 times 

don't shave more than once every 2 days - and that's the soonest i’d ever reshave. 5-7 is better

dif things work for dif people. my fav gentle moisturizer is aveeno baby eczema in a tube not a jar (jar is super thick like vaseline). hydrocortisone 1% can help too if you have any itchiness or irritation, or an aloe vera gel immediately after",34,1745701615.0,44,50
1k8mm5n,[Hair Removal] How to make shaving *down there* more bearable?,mp7gmwb,"Man here; similar bumps up top but nothing lower down. 


Among my time in the wet shaving and double edge razor forums I've found that bump stopper can work in the pubic area but my parts are less susceptible to exposure; it may work but would require careful application and removal. Wife never tried it as she went with lasers and wax usually.


The biggest thing for me was not using a multi blade razor. A double edge single blade reduced irritation greatly for that area while the multi blade is still best for the tight corners. 


Beyond that, trimming instead of full shaving is best but that's not your goal. 


Hope this helped, if not I hope someone edit: didn't finish the sentence apparently; hope some comes by who has more applicable first hand experience. ",22,1745700641.0,44,50
1k8mm5n,[Hair Removal] How to make shaving *down there* more bearable?,mp7kb4k,I get the exact same.  I use a product called Skin Tend.  They sell it at my local Target.  I wipe it on right after and then every morning and every night.  It works 90% of the time.,14,1745701833.0,44,50
1k8mm5n,[Hair Removal] How to make shaving *down there* more bearable?,mp9q9dm,"Skip the razor, use a trimmer to get it down and a foil shaver to get it close. Can speak on pubes but works well on the face. You can try a Phillips one blade which does both but I opt for a clipper and foil shaver for the face. You will get some redness and irritation at first but the body should get use to it.",5,1745732501.0,44,50
1k8mm5n,[Hair Removal] How to make shaving *down there* more bearable?,mp7nyso,"tbh taking a hot shower before and buying a new sharp razor helped me a lot but now i just use a brand called veet, which is a hair remover cream, which apparently isn’t recommended by doctors but oh well 😭",4,1745703072.0,44,50
1k8mm5n,[Hair Removal] How to make shaving *down there* more bearable?,mp7lr9t,Use baby oil instead of shaving cream,6,1745702322.0,44,50
1k8mm5n,[Hair Removal] How to make shaving *down there* more bearable?,mp7g8x2,"Don’t do it. I bought the Ulike laser thing. It takes more sessions than professional laser, but it’s working!",10,1745700517.0,44,50
1k8mm5n,[Hair Removal] How to make shaving *down there* more bearable?,mp7eepd,"Hi there,

It seems like you may be looking for information about shaving or irritation from shaving (ingrown hairs, razor burn, etc). Have you read our [shaving wiki](https://www.reddit.com/r/SkincareAddiction/wiki/shaving)?

*If you see that I am replying to something out of context (eg. listed in a routine), please report this comment so my handlers can remove it. Cheers!*


*I am a bot, and this action was performed automatically. Please [contact the moderators of this subreddit](/message/compose/?to=/r/SkincareAddiction) if you have any questions or concerns.*",2,1745699928.0,44,50
1k8mm5n,[Hair Removal] How to make shaving *down there* more bearable?,mp8cjh6,"I saw some tiktok years ago about how to do it and I’m so prone to ingrown hairs that I figured why now. I’ve been doing it since lol 

Routine:
Exfoliate physically - I use a body brush or African net
Shave with the grain. Do not go against the grain. Yes it will make it feel smoother. It is not worth it. At all. Pull the skin as you shave as well to get a slightly closer shave. I like the use a safety razor but that takes some practice.

Immediately out of the shower I mix witch hazel and aloe and apply it straight to where I shaved. 

And I try to keep things loose for clothing that night when I sleep but yeah that’s just what works for me",4,1745711535.0,44,50
1k8mm5n,[Hair Removal] How to make shaving *down there* more bearable?,mp85gj8,Phillips One Blade. Apply Venus Daily Soothing Serum… daily.,4,1745709042.0,44,50
1k8mm5n,[Hair Removal] How to make shaving *down there* more bearable?,mp8gtjy,Professional laser was a game changer,1,1745713141.0,44,50
1k8mm5n,[Hair Removal] How to make shaving *down there* more bearable?,mp9vgec,"Using a Philips Lumea to zap everything away for minimal/no growth.

Yes you gotta shave first and then use it. (Follow the shaving advice from others) I used to get the worst ingrowns and now not anymore. Worth every penny imo.

Depends of course though on your skin tone and haircolour",1,1745735491.0,44,50
1k8mm5n,[Hair Removal] How to make shaving *down there* more bearable?,mpbxatj,I started getting Brazilians and I haven't shaved in years. They def hurt and the first one is the worst but it gets better with time and your hair grows back in less and thinner. I take a deep breath and have the waxer count down to when they're going to pull and breathe out hard when they pull the wax. It helps w the pain for sure. The results are sooo much better than shaving. I use trueskin it's a blue bottle for after waxing to prevent ingrowns.,1,1745769607.0,44,50
1k8mm5n,[Hair Removal] How to make shaving *down there* more bearable?,mpcp5li,get waxed or laser hair removal!,1,1745778050.0,44,50
1k8mm5n,[Hair Removal] How to make shaving *down there* more bearable?,mp8v2gd,"If you get bumps starts exfoliating, I'm telling you it 100% stops like never ever bump comes ,.use a scrub , I use chemical exfoliants like lactic or salicylic or glycolic all works very well",1,1745718579.0,44,50
1k8mm5n,[Hair Removal] How to make shaving *down there* more bearable?,mp81ifz,"I use Aussie moist conditioner I buy a big o bottle from Walmart and shave with it.

First shower, wash yourself let the water soak the hair (hair is wet soft). Then put conditioner down there and use a man’s shaver I used the shicks 5 blade",1,1745707695.0,44,50
1k78rp7,[Misc] How many ounces of water are you guys drinking daily?,mow6bvn,"



Are you brand new to skincare? Don't know how to build a skincare routine? The best place to start is our [ScA Routine](https://www.reddit.com/r/SkincareAddiction/wiki/sca_routine/)! 

You can find even more skincare guides [in our wiki!](https://www.reddit.com/r/SkincareAddiction/wiki/index). Your answer might already be in there (and if it is, we might remove your post).

Everyone is welcome in [this community](https://www.reddit.com/r/SkincareAddiction/wiki/about); remember to be kind and assume good faith :)


*I am a bot, and this action was performed automatically. Please [contact the moderators of this subreddit](/message/compose/?to=/r/SkincareAddiction) if you have any questions or concerns.*",1,1745543811.0,39,50
1k78rp7,[Misc] How many ounces of water are you guys drinking daily?,mowg5zv,"[Research has found that for the most part, unless you aren’t drinking water regularly - drinking *more* water than the daily recommended amount isn’t going to do much for your skin](https://pmc.ncbi.nlm.nih.gov/articles/PMC11148315/)

[Daily liquid intake recommendations are ~3L a day for women and men ~4L. This includes water from other beverages & food too](https://www.mayoclinic.org/healthy-lifestyle/nutrition-and-healthy-eating/in-depth/water/art-20044256). And  this will change a lot based on different factors like daily activity, environment, medications, diet.",47,1745547141.0,39,50
1k78rp7,[Misc] How many ounces of water are you guys drinking daily?,moweco5,[deleted],38,1745546523.0,39,50
1k78rp7,[Misc] How many ounces of water are you guys drinking daily?,mow8m25,I try to drink minimum 80 oz a day but need more when I exercise.,15,1745544591.0,39,50
1k78rp7,[Misc] How many ounces of water are you guys drinking daily?,mow988n,"I follow this as my baseline:  
(Your Weight) x (0.5) = oz. water per day  
e.g. 100 lb x 0.5 = 50 oz. water

Of course, there are multiple variables here.. age, exercise, pregnancy, etc.

That said, I personally just focus on the baseline, because I'm trying my best over here too. lol",19,1745544802.0,39,50
1k78rp7,[Misc] How many ounces of water are you guys drinking daily?,mowdonp,If I can make it to 33oz we are having a good day.,4,1745546300.0,39,50
1k78rp7,[Misc] How many ounces of water are you guys drinking daily?,mowgliv,"I try to drink at least 2-3 litres a day minimum, I get headaches and blocked sinuses when I’m dehydrated!",4,1745547290.0,39,50
1k78rp7,[Misc] How many ounces of water are you guys drinking daily?,mowj8yr,"160+ oz. Water is all I drink and I always have it next to me. It’s like an absentminded habit now. 

I really only notice a difference in my skin when I’m sick and not drinking much water. After I get better and am back to drinking more water, all the lines that popped out go away. I look so much older when I’m dehydrated lol",4,1745548213.0,39,50
1k78rp7,[Misc] How many ounces of water are you guys drinking daily?,mowfwmk,What's water?,5,1745547049.0,39,50
1k78rp7,[Misc] How many ounces of water are you guys drinking daily?,mox39nw,"About 68 oz or 2 liters of water as a woman. That doesn’t include my other liquid intake like coffee, tea, orange juice, etc.",3,1745556135.0,39,50
1k78rp7,[Misc] How many ounces of water are you guys drinking daily?,mow8sbo,I drink 128oz a day. I’m also doing it for weight loss but have noticed a real improvement in my skin too,4,1745544649.0,39,50
1k78rp7,[Misc] How many ounces of water are you guys drinking daily?,moxlbmm,I drink about 150oz but depends on how much I’m sweating. Can get up to 200oz if I do a strenuous workout or run,2,1745566056.0,39,50
1k78rp7,[Misc] How many ounces of water are you guys drinking daily?,moxnnsj,2-3L per day,2,1745567515.0,39,50
1k78rp7,[Misc] How many ounces of water are you guys drinking daily?,moxvcp8,"I dunno about ounces but I generally drink 2 to 3 liters of water per day, excluding the water in my coffee, occasional glass of juice and the two small meals I typically have. I also have fluid replacement tablets daily. I still always feel dehydrated, my skin, eyes and mouth are constantly dry, but at this point I really can't think it's because I'm not getting enough water.",2,1745572377.0,39,50
1k78rp7,[Misc] How many ounces of water are you guys drinking daily?,moy3ajd,About 2L,2,1745577053.0,39,50
1k78rp7,[Misc] How many ounces of water are you guys drinking daily?,moy5ag6,"If your lips are crunchy, you’re not drinking enough water",2,1745578099.0,39,50
1k78rp7,[Misc] How many ounces of water are you guys drinking daily?,moye58r,"it may not be true and also as what other people said it depends on the weight too but I saw it somewhere to set up the goal to reach 64oz per day if possible, which is also good for the skin yeah",2,1745582111.0,39,50
1k78rp7,[Misc] How many ounces of water are you guys drinking daily?,moz8yhd,"I aim for 3 litres a day. I have a crepey neck due to weight loss and when I don't get at least 2.5 litres it looks so much worse. The water really plumps the skin up,it's like magic.",2,1745592524.0,39,50
1k78rp7,[Misc] How many ounces of water are you guys drinking daily?,mowbpcl,"I’m drinking 100oz per day of plain/sparkling water. But I don’t notice any real difference between 75 and 100

But I’m also having 24oz of celery juice, and a 12oz strong coffee. And yes, I pee all the time

Also! Electrolytes in the water are important!",3,1745545632.0,39,50
1k78rp7,[Misc] How many ounces of water are you guys drinking daily?,mowd7u0,I’ve started chugging a glass as part of my morning and evening skincare routine. I’m not great about drinking it in between,1,1745546147.0,39,50
